[
  {
    "id": "venue-alexanderplatz",
    "name": "Alexanderplatz",
    "address": "Rathausstraße, 10178 Berlin",
    "description": "A free public court near Alexanderplatz, close to the TV Tower. Parkinspector lists one court here. The playing surface is decent sand. It has a fixed net and no boundary lines.",
    "pricing": "free",
    "accessType": "public",
    "environment": "outdoor",
    "latitude": 52.51975706751368,
    "longitude": 13.40905323293103,
    "courtCountTotal": 1,
    "indoorCourtCount": 0,
    "outdoorCourtCount": 1,
    "websiteUrl": "https://parkinspector.de/parks/Beachen/Alexanderplatz/443",
    "bookingUrl": null,
    "googleMapsUrl": "https://goo.gl/maps/DNwggsJ6Q1CZdfx4A",
    "openingHoursText": "08:00 - 13:00  / 15:00 - 20:00",
    "seasonalityText": "Outdoor public/community spot, weather/daylight dependent.",
    "amenities": [
      "public outdoor court",
      "toilets",
      "posted opening hours"
    ],
    "sourceUrls": [
      "https://parkinspector.de/parks/Beachen/Alexanderplatz/443"
    ],
    "imageGallery": [
      {
        "url": "https://parkinspector.de/api/?files&file=ef2800b011ae3d77390c23f6e3a041bf70947950--Bild1_cut-min.jpg&width=1600",
        "sourceUrl": "https://parkinspector.de/parks/Beachen/Alexanderplatz/443",
        "credit": "Parkinspector",
        "license": "Permission required; no reusable license found during research",
        "rightsStatus": "requires_permission"
      },
      {
        "url": "https://parkinspector.de/api/?files&file=8b9cce77cc9baf1746fc355598bcde7e4782fe3a--a.jpg&width=1600",
        "sourceUrl": "https://parkinspector.de/parks/Beachen/Alexanderplatz/443",
        "credit": "Parkinspector",
        "license": "Permission required; no reusable license found during research",
        "rightsStatus": "requires_permission"
      }
    ],
    "facts": {
      "surface": "decent sand",
      "equipment": [
        "fixed net",
        "no boundary lines"
      ],
      "playerLevel": "very few players",
      "areaNotes": [
        "Watch out: damaged net, rough surroundings"
      ],
      "parkInspectorScore": 39
    }
  },
  {
    "id": "venue-baseball-rams",
    "name": "Baseball Rams",
    "address": "Sachtlebenstraße 36, 14165 Berlin",
    "description": "A quiet public court beside the Berlin Rams baseball grounds in Zehlendorf. Parkinspector lists one court here. The playing surface is well-kept sand. It has a fixed net and no boundary lines.",
    "pricing": "free",
    "accessType": "mixed",
    "environment": "outdoor",
    "latitude": 52.412256484093206,
    "longitude": 13.250357810079104,
    "courtCountTotal": 1,
    "indoorCourtCount": 0,
    "outdoorCourtCount": 1,
    "websiteUrl": "https://parkinspector.de/parks/Beachen/Baseball-Rams/769",
    "bookingUrl": null,
    "googleMapsUrl": "https://maps.app.goo.gl/JVwQQUnA7hMbLcN69",
    "openingHoursText": "Public/open access per Parkinspector; no formal booking found.",
    "seasonalityText": "Outdoor public/community spot, weather/daylight dependent.",
    "amenities": [
      "public outdoor court",
      "club grounds",
      "basketball nearby"
    ],
    "sourceUrls": [
      "https://parkinspector.de/parks/Beachen/Baseball-Rams/769"
    ],
    "imageGallery": [
      {
        "url": "https://parkinspector.de/api/?files&file=a402d950680cfd276ed135fecec753cd57fdea14--bild1_rams.jpg&width=1600",
        "sourceUrl": "https://parkinspector.de/parks/Beachen/Baseball-Rams/769",
        "credit": "Parkinspector",
        "license": "Permission required; no reusable license found during research",
        "rightsStatus": "requires_permission"
      },
      {
        "url": "https://parkinspector.de/api/?files&file=3879f18927ae73041b52b2040bc8fc5aad44ba7e--a.jpg&width=1600",
        "sourceUrl": "https://parkinspector.de/parks/Beachen/Baseball-Rams/769",
        "credit": "Parkinspector",
        "license": "Permission required; no reusable license found during research",
        "rightsStatus": "requires_permission"
      }
    ],
    "facts": {
      "surface": "well-kept sand",
      "equipment": [
        "fixed net",
        "no boundary lines"
      ],
      "playerLevel": "very few players",
      "areaNotes": [
        "Positive: large playing area",
        "Watch out: no benches"
      ],
      "parkInspectorScore": 30
    }
  },
  {
    "id": "venue-schlupfwinkel",
    "name": "Beachvolleyballfeld Schlupfwinkel",
    "address": "Kaiserin-Augusta-Allee 100, 10553 Berlin",
    "description": "Community-listed free sand area next to Jugendclub Schlupfwinkel; bring a net and use hooks in the stone surround.",
    "pricing": "free",
    "accessType": "public",
    "environment": "outdoor",
    "latitude": 52.526,
    "longitude": 13.32,
    "courtCountTotal": 1,
    "indoorCourtCount": 0,
    "outdoorCourtCount": 1,
    "websiteUrl": null,
    "bookingUrl": null,
    "googleMapsUrl": "https://www.google.com/maps/search/?api=1&query=Kaiserin-Augusta-Allee%20100%2010553%20Berlin%20Beachvolleyball",
    "openingHoursText": "BeachUp notes nearby youth club open roughly 13:00-20:00; public court access not formally scheduled.",
    "seasonalityText": "Outdoor community court, weather/daylight dependent.",
    "amenities": [
      "bring own net",
      "hooks for net ropes",
      "near youth club toilets by request"
    ],
    "sourceUrls": [
      "https://www.beachup.app/de/beachvolleyballplaetze/deutschland/berlin/"
    ],
    "imageGallery": [],
    "facts": {
      "surface": null,
      "equipment": [],
      "playerLevel": null,
      "areaNotes": [],
      "parkInspectorScore": null
    }
  },
  {
    "id": "venue-benn-wartenberg",
    "name": "BENN Wartenberg",
    "address": "Schweriner Ring 27, 13059 Berlin",
    "description": "A small neighborhood beach volleyball court in Wartenberg. Parkinspector lists one court here. The playing surface is well-kept sand. It has a fixed net and no boundary lines.",
    "pricing": "free",
    "accessType": "public",
    "environment": "outdoor",
    "latitude": 52.57752854123584,
    "longitude": 13.509280148377163,
    "courtCountTotal": 1,
    "indoorCourtCount": 0,
    "outdoorCourtCount": 1,
    "websiteUrl": "https://parkinspector.de/parks/Beachen/Benn-Wartenberg/638",
    "bookingUrl": null,
    "googleMapsUrl": "https://goo.gl/maps/q8ZaTVzBNcSRkFC5A",
    "openingHoursText": "Public/open access per Parkinspector; no formal booking found.",
    "seasonalityText": "Outdoor public/community spot, weather/daylight dependent.",
    "amenities": [
      "public outdoor court"
    ],
    "sourceUrls": [
      "https://parkinspector.de/parks/Beachen/Benn-Wartenberg/638"
    ],
    "imageGallery": [
      {
        "url": "https://parkinspector.de/api/?files&file=63bbc4ffab0dd7e4bf630f2472300f051a83d32d--Bild1_wartenberg.jpg&width=1600",
        "sourceUrl": "https://parkinspector.de/parks/Beachen/Benn-Wartenberg/638",
        "credit": "Parkinspector",
        "license": "Permission required; no reusable license found during research",
        "rightsStatus": "requires_permission"
      },
      {
        "url": "https://parkinspector.de/api/?files&file=13ac29a54ee665cbad973b9de78b653ce1191efe--a.jpg&width=1600",
        "sourceUrl": "https://parkinspector.de/parks/Beachen/Benn-Wartenberg/638",
        "credit": "Parkinspector",
        "license": "Permission required; no reusable license found during research",
        "rightsStatus": "requires_permission"
      }
    ],
    "facts": {
      "surface": "well-kept sand",
      "equipment": [
        "fixed net",
        "no boundary lines"
      ],
      "playerLevel": "very few players",
      "areaNotes": [
        "Watch out: no seating"
      ],
      "parkInspectorScore": 28
    }
  },
  {
    "id": "venue-biesdorfer-baggersee",
    "name": "Biesdorfer Baggersee",
    "address": "Baggerseestraße, 12683 Berlin",
    "description": "A public outdoor beach volleyball spot in Biesdorf. Parkinspector lists one court here. The playing surface is well-kept sand. It has a fixed net and boundary lines.",
    "pricing": "free",
    "accessType": "public",
    "environment": "outdoor",
    "latitude": 52.50254394960772,
    "longitude": 13.546616355819872,
    "courtCountTotal": 1,
    "indoorCourtCount": 0,
    "outdoorCourtCount": 1,
    "websiteUrl": "https://parkinspector.de/parks/Beachen/Biesdorfer-Baggersee/514",
    "bookingUrl": null,
    "googleMapsUrl": "https://goo.gl/maps/J5whsd455iu8tVEj7",
    "openingHoursText": "Public/open access per Parkinspector; no formal booking found.",
    "seasonalityText": "Outdoor public/community spot, weather/daylight dependent.",
    "amenities": [
      "public outdoor court",
      "bathing lake",
      "water nearby"
    ],
    "sourceUrls": [
      "https://parkinspector.de/parks/Beachen/Biesdorfer-Baggersee/514"
    ],
    "imageGallery": [
      {
        "url": "https://parkinspector.de/api/?files&file=78c24dba1bdb9e8b1c20044b994493b8ec096329--Bild1_cut-min.jpg&width=1600",
        "sourceUrl": "https://parkinspector.de/parks/Beachen/Biesdorfer-Baggersee/514",
        "credit": "Parkinspector",
        "license": "Permission required; no reusable license found during research",
        "rightsStatus": "requires_permission"
      },
      {
        "url": "https://parkinspector.de/api/?files&file=fe2a83a68a9771793c2b1ae95b293c16b766e3dc--a.jpg&width=1600",
        "sourceUrl": "https://parkinspector.de/parks/Beachen/Biesdorfer-Baggersee/514",
        "credit": "Parkinspector",
        "license": "Permission required; no reusable license found during research",
        "rightsStatus": "requires_permission"
      }
    ],
    "facts": {
      "surface": "well-kept sand",
      "equipment": [
        "fixed net",
        "boundary lines"
      ],
      "playerLevel": "casual players",
      "areaNotes": [
        "Watch out: narrow net, Nicht, Originalhöhe"
      ],
      "parkInspectorScore": 40
    }
  },
  {